{
  "schema_version": 2,
  "durability_reason": "ephemeral",
  "subject_identity": "exact artifact, revision, or operation identity",
  "environment_identity": "exact environment or configuration identity",
  "procedure": "bounded procedure that produced the observation",
  "claims": [
    {
      "id": "claim-id",
      "outcome": "INCONCLUSIVE",
      "observation": "direct non-secret observation"
    }
  ],
  "evidence_ref": "durable non-secret evidence location",
  "captured_at": "timestamp or event identity",
  "limitations": [],
  "source_disposition": "not_sensitive"
}
